{
  "$schema": "https://json-schema.org/draft/2020-12/schema",
  "title": "Party quest (information-gap)",
  "type": "object",
  "required": ["id", "unit", "title", "party", "roles"],
  "properties": {
    "id":    { "type": "string", "pattern": "^[a-z0-9_]+$" },
    "unit":  { "type": "integer", "minimum": 1 },
    "names": { "type": "array", "items": { "type": "string", "minLength": 1 } },
    "title": { "$ref": "#/$defs/text" },
    "party": {
      "type": "object",
      "required": ["min", "max"],
      "properties": {
        "min": { "type": "integer", "minimum": 1, "maximum": 7 },
        "max": { "type": "integer", "minimum": 1, "maximum": 7 }
      },
      "additionalProperties": false
    },
    "roles": {
      "type": "array",
      "minItems": 1,
      "maxItems": 7,
      "items": {
        "type": "object",
        "required": ["role", "goal", "phrases"],
        "properties": {
          "role": { "enum": ["gatherer", "gardener", "fisher", "cook", "explorer", "messenger", "helper"] },
          "goal": { "$ref": "#/$defs/text" },
          "has":  { "type": "array", "items": { "type": "string" } },
          "needs": { "type": "array", "items": { "type": "string" } },
          "phrases": { "type": "array", "minItems": 1, "items": { "$ref": "#/$defs/text" } }
        },
        "additionalProperties": false
      }
    }
  },
  "$defs": {
    "text": {
      "type": "object",
      "required": ["en", "ko"],
      "properties": {
        "en": { "type": "string", "minLength": 1 },
        "ko": { "type": "string", "minLength": 1 }
      },
      "additionalProperties": false
    }
  },
  "additionalProperties": false
}
